{"authority":"NONE","base_sha":"97d33978e2b416334194b27bba1ae03f514b661a","changed_files":["docs/sscm-fanout-a.txt","docs/sscm-fanout-b.txt"],"integrated_sha":"916826117fcd3cdf729966ebf7db5c063ed65583","integration_method":"git cherry-pick, frozen task-id order","integration_order":["task:fanout-a","task:fanout-b"],"mission_id":"mission-sscm-01b-live-2","schema_version":"sovereign.sscm-integration-receipt.v0.1","verification":{"changed_files_exact":true,"content_exact":true,"descends_from_base":true,"worktree_clean":true},"worker_candidates":[{"imported_ref":"refs/sscm/import/fanout-a","imported_sha":"7531f8031097dcec47100da161809eede33d763c","source_git_common_dir":"/home/kowen9024/sovereign/.sovereign/runs/mission-sscm-01b-live-2/workspaces/worker-a.git","task_id":"task:fanout-a","verified_sha":"7531f8031097dcec47100da161809eede33d763c"},{"imported_ref":"refs/sscm/import/fanout-b","imported_sha":"6a8c1a21f45c8e1a827fe64adc88ee051597c4aa","source_git_common_dir":"/home/kowen9024/sovereign/.sovereign/runs/mission-sscm-01b-live-2/workspaces/worker-b.git","task_id":"task:fanout-b","verified_sha":"6a8c1a21f45c8e1a827fe64adc88ee051597c4aa"}]}
